Video ID; Title; URL; Views; Likes; Comments; Download 
3YltYCrPZos; The Boo Boo Song | CoComelon Nursery Rhymes &amp; Kids Songs; https://www.youtube.com/watch?v=3YltYCrPZos; 1265760279; 3385331; 0; 2019-04-09
vb8wloc4Xpw; Becky G, KAROL G - MAMIII (Audio); https://www.youtube.com/watch?v=vb8wloc4Xpw; 207443941; 2490127; 74050; 2022-02-10
9w4LBN7JljQ; MÚSICA DO DODÓI COM MARIA CLARA E JP ♫ The Boo Boo Song! Nursery Rhymes Songs for Kids; https://www.youtube.com/watch?v=9w4LBN7JljQ; 153947045; 511299; 0; 2020-01-25
_YP57FcERcM; The Boo Boo Song Nursery Rhymes &amp; Kids Songs 病気の歌; https://www.youtube.com/watch?v=_YP57FcERcM; 110606435; 268300; 0; 2021-03-06
9Pr6LwQkrQI; MUMMY NU PASAND Full Video | Jai Mummy Di l Sunny S, Sonnalli S lJaani, Sunanda S, Tanishk B, Sukh-E; https://www.youtube.com/watch?v=9Pr6LwQkrQI; 87942148; 408864; 6333; 2020-01-31
