Video ID; Title; URL; Views; Likes; Comments; Download 
SYwpvfhpNJw; favorite sound effecting mom clips😇; https://www.youtube.com/watch?v=SYwpvfhpNJw; 215178571; 12076796; 49734; 2021-11-24
ZTc991t51d4; Vlad and Niki Cooking and playing with Mom - Funny stories for children; https://www.youtube.com/watch?v=ZTc991t51d4; 204390120; 874424; 0; 2021-05-03
7XT0AIHdMxQ; Toys gets stuck on mom&#39;s face / Vlad and Niki; https://www.youtube.com/watch?v=7XT0AIHdMxQ; 152052927; 649502; 0; 2020-05-02
qiJ6KZCy55c; Vlad and Niki help mom and more episodes for kids; https://www.youtube.com/watch?v=qiJ6KZCy55c; 104635000; 363119; 0; 2022-01-25
lw0myT99ro4; ESCAPING ANGRY MOM (Epic Parkour Chase in Paris); https://www.youtube.com/watch?v=lw0myT99ro4; 96630097; 796549; 22076; 2020-12-10
